sc1_mthd_id,sc1_mthd,desc,created_date,modified_date,modified_by
1,bval.apid.nwlls.med,plate-wise baseline based on neutral ctrl median value,2015-05-13 11:44:35,0000-00-00 00:00:00,dfiler.dfiler.dfiler
2,bval.apid.twlls.med,"Take the median cval of the t wells, by apid",2015-05-13 11:44:35,0000-00-00 00:00:00,dfiler.dfiler.dfiler
3,bval.apid.tn.med,"Take the median cval of the t and n wells, by apid",2015-05-13 11:44:35,0000-00-00 00:00:00,dfiler.dfiler.dfiler
4,pval.apid.pwlls.med,"plate-wise meidan based on positive control, single dose",2015-05-13 11:44:35,0000-00-00 00:00:00,dfiler.dfiler.dfiler
5,pval.apid.mwlls.med,"plate-wise meidan based on negative control, single dose",2015-05-13 11:44:35,0000-00-00 00:00:00,dfiler.dfiler.dfiler
6,pval.apid.medpcbyconc.max,plate-wise median response of positive control (max),2015-05-13 11:44:35,0000-00-00 00:00:00,dfiler.dfiler.dfiler
7,pval.apid.medpcbyconc.min,plate-wise median response of positive control (min),2015-05-13 11:44:35,0000-00-00 00:00:00,dfiler.dfiler.dfiler
8,pval.apid.medncbyconc.min,"plate-wise meidan based on negative control, (min)",2015-05-13 11:44:35,0000-00-00 00:00:00,dfiler.dfiler.dfiler
9,pval.zero,Set pval to 0.,2015-05-13 11:44:35,0000-00-00 00:00:00,dfiler.dfiler.dfiler
10,resp.pc,response percent activity,2015-05-13 11:44:35,0000-00-00 00:00:00,dfiler.dfiler.dfiler
11,resp.fc,calculate response as fold-change,2015-05-13 11:44:35,0000-00-00 00:00:00,dfiler.dfiler.dfiler
12,resp.logfc,Calculate the response as a fold change over baseline for logged values,2015-05-13 11:44:35,0000-00-00 00:00:00,dfiler.dfiler.dfiler
13,resp.log2,take the log base 2 of the response,2015-05-13 11:44:35,0000-00-00 00:00:00,dfiler.dfiler.dfiler
14,none,apply no level 2 method,2015-05-13 11:44:35,0000-00-00 00:00:00,dfiler.dfiler.dfiler
16,resp.multneg1,multiply response values by negative 1,2015-05-29 10:27:45,0000-00-00 00:00:00,Akarmaus.Akarmaus.Akarmaus
17,pval.apid.or.aeid.pwlls.med,calculates pval first based on p wells by plate and then for any plates missing p wells it calculates a pval by median of pval for all other plates,2015-09-30 14:43:40,0000-00-00 00:00:00,mmarti02.mmarti02.mmarti02
